{
  "schema_version": "navigation-goal-coverage.v1",
  "updated_at": "2026-08-04T12:08:32+09:00",
  "source_scope": "real_device_exploration_status",
  "success_definition": "destination_observed_without_automatic_dangerous_final_action",
  "holdout_policy": "locked_holdout_is_evaluated_only_after_collection_freeze_and_never_used_for_tuning_or_promotion",
  "coverage_split_manifest": "db/navigation_coverage_split_v1.json",
  "collection_frozen_at": null,
  "holdout_evaluation_started_at": null,
  "goal_order": [
    "account.signup",
    "account.delete",
    "membership.join",
    "membership.change",
    "membership.cancel"
  ],
  "apps": [
    {
      "app_package": "com.instagram.android",
      "app_name": "Instagram",
      "split": "locked_holdout",
      "app_version": null,
      "goals": [
        {"goal_id": "account.signup", "status": "not_explored", "display_status_ko": "미탐색", "evidence_level": "none", "evidence_refs": [], "last_observed_at": null, "blocking_issue": null, "dangerous_action_auto_executed": false, "notes": ""},
        {"goal_id": "account.delete", "status": "not_explored", "display_status_ko": "미탐색", "evidence_level": "none", "evidence_refs": [], "last_observed_at": null, "blocking_issue": null, "dangerous_action_auto_executed": false, "notes": ""},
        {"goal_id": "membership.join", "status": "not_explored", "display_status_ko": "미탐색", "evidence_level": "none", "evidence_refs": [], "last_observed_at": null, "blocking_issue": null, "dangerous_action_auto_executed": false, "notes": ""},
        {"goal_id": "membership.change", "status": "not_explored", "display_status_ko": "미탐색", "evidence_level": "none", "evidence_refs": [], "last_observed_at": null, "blocking_issue": null, "dangerous_action_auto_executed": false, "notes": ""},
        {"goal_id": "membership.cancel", "status": "not_explored", "display_status_ko": "미탐색", "evidence_level": "none", "evidence_refs": [], "last_observed_at": null, "blocking_issue": null, "dangerous_action_auto_executed": false, "notes": ""}
      ]
    },
    {
      "app_package": "com.google.android.youtube",
      "app_name": "YouTube",
      "split": "collection",
      "app_version": "21.31.524+1561190182",
      "goals": [
        {"goal_id": "account.signup", "status": "not_testable", "display_status_ko": "현재 계정 상태에서 검증 불가(기기 본인 인증 필요)", "evidence_level": "real_device_verified", "evidence_refs": ["docs/evidence/youtube-account-signup-auth-boundary-20260804.md", "runtime:navs_e4aba79599d74068b3d46633f0aeb69d", "n100:/srv/exitguide/runtime/promotion-youtube-account-signup-auth-boundary-20260804/interaction-episodes.jsonl", "n100:/srv/exitguide/runtime/promotion-youtube-account-signup-auth-boundary-20260804/promotion-candidates.jsonl"], "last_observed_at": "2026-08-04T12:08:32+09:00", "blocking_issue": "account_state", "dangerous_action_auto_executed": false, "notes": "내 페이지→계정→계정 추가를 candidate_id로 실행한 뒤 Samsung 생체 인증·기기 자격 증명 프롬프트를 실제 관찰했다. 인증·로그아웃을 자동 실행하지 않고 stop_for_user로 종료했으며 아동용 계정과 기존 Google 계정 관리는 일반 회원가입 후보에서 제외했다."},
        {"goal_id": "account.delete", "status": "destination_reached", "display_status_ko": "목적지 도달", "evidence_level": "real_device_verified", "evidence_refs": ["docs/evidence/youtube-account-delete-destination-20260804.md", "runtime:navs_46bdd8ecf95547ddbc30af27da18c74a", "n100:/srv/exitguide/runtime/promotion-youtube-account-delete-final-20260804/interaction-episodes.jsonl", "n100:/srv/exitguide/runtime/promotion-youtube-account-delete-final-20260804/promotion-candidates.jsonl"], "last_observed_at": "2026-08-04T11:46:16+09:00", "blocking_issue": null, "dangerous_action_auto_executed": false, "notes": "내 페이지→계정→Google 계정 관리→데이터 및 개인 정보 보호를 candidate_id로 이동하고 제한 스크롤 후 Google 계정 삭제 후보를 관찰했다. 최종 후보는 high risk였고 클릭하지 않은 채 destination_reached로 종료했다."},
        {"goal_id": "membership.join", "status": "not_testable", "display_status_ko": "현재 계정에서 검증 불가(이미 가입됨)", "evidence_level": "real_device_verified", "evidence_refs": ["docs/REAL_DEVICE_COLLECTION_2026-08-03.md", "runtime:navs_4add085e43b54c808ad3f70b76a9f50d"], "last_observed_at": "2026-08-03T09:15:48+09:00", "blocking_issue": "account_state", "dangerous_action_auto_executed": false, "notes": "Premium 회원 상태를 실제 화면에서 확인했으며 신규 가입 성공으로 승격하지 않음"},
        {"goal_id": "membership.change", "status": "not_testable", "display_status_ko": "현재 서비스 정책에서 검증 불가(요금제 변경 옵션 없음)", "evidence_level": "real_device_verified", "evidence_refs": ["docs/evidence/youtube-membership-change-service-policy-20260804.md", "runtime:navs_5e40c4483d1b46068caa6c6ce039cb75"], "last_observed_at": "2026-08-04T09:10:18+09:00", "blocking_issue": "service_policy", "dangerous_action_auto_executed": false, "notes": "활성 Premium에서 Google Play 관리→설정까지 candidate_id 클릭으로 검증했다. 예비 결제수단 관리만 노출되고 요금제 변경·플랜 변경·업그레이드·다운그레이드 후보가 없어 현재 서비스 구성에서는 검증할 수 없다."},
        {"goal_id": "membership.cancel", "status": "safe_boundary_reached", "display_status_ko": "안전 경계 도달", "evidence_level": "real_device_verified", "evidence_refs": ["docs/evidence/youtube-membership-cancel-safe-boundary-20260804.md", "docs/evidence/youtube-membership-cancel-interaction-episodes-20260804.jsonl", "docs/evidence/youtube-membership-cancel-promotion-candidates-20260804.jsonl", "runtime:navs_a08c470f59ed4a8ba5e172837fc70b3a", "runtime:navs_e86d731eecd444c8b2fde916006b49d4"], "last_observed_at": "2026-08-04T07:56:32+09:00", "blocking_issue": null, "dangerous_action_auto_executed": false, "notes": "만료 채널 멤버십에서 back()으로 복구하고 활성 YouTube Premium 행을 선택해 다음 결제일·취소 화면에 도달. 취소 후보를 high로 분류한 뒤 stop_for_user로 종료"}
      ]
    },
    {
      "app_package": "com.netflix.mediaclient",
      "app_name": "Netflix",
      "split": "collection",
      "app_version": "9.77.0 build 9 64328+64328",
      "goals": [
        {"goal_id": "account.signup", "status": "not_explored", "display_status_ko": "미탐색", "evidence_level": "none", "evidence_refs": [], "last_observed_at": null, "blocking_issue": null, "dangerous_action_auto_executed": false, "notes": ""},
        {"goal_id": "account.delete", "status": "not_explored", "display_status_ko": "미탐색", "evidence_level": "none", "evidence_refs": [], "last_observed_at": null, "blocking_issue": null, "dangerous_action_auto_executed": false, "notes": ""},
        {"goal_id": "membership.join", "status": "in_progress", "display_status_ko": "진행 중(렌더링 오류 복구 필요)", "evidence_level": "recorded_observation", "evidence_refs": ["docs/REAL_DEVICE_COLLECTION_2026-08-03.md"], "last_observed_at": "2026-08-03T09:15:48+09:00", "blocking_issue": "app_rendering_error", "dangerous_action_auto_executed": false, "notes": "SignupNativeActivity 검은 화면은 탐색 실패나 미지원으로 판정하지 않음"},
        {"goal_id": "membership.change", "status": "not_explored", "display_status_ko": "미탐색", "evidence_level": "none", "evidence_refs": [], "last_observed_at": null, "blocking_issue": null, "dangerous_action_auto_executed": false, "notes": ""},
        {"goal_id": "membership.cancel", "status": "safe_boundary_reached", "display_status_ko": "안전 경계 도달", "evidence_level": "real_device_verified", "evidence_refs": ["docs/evidence/netflix-membership-cancel-safe-boundary-20260804.md", "runtime:navs_c69db94650b94d9ca9595c90dfa8bed4", "runtime:navs_20210f0aa6d34236b86f223d9861e827"], "last_observed_at": "2026-08-04T06:46:30+09:00", "blocking_issue": null, "dangerous_action_auto_executed": false, "notes": "계정 WebView 하단의 멤버십 해지 후보를 관찰했고 high/terminal/dangerous_final로 분류한 뒤 클릭 없이 stop_for_user로 종료"}
      ]
    },
    {
      "app_package": "com.parksmt.jejuair.android16",
      "app_name": "제주항공",
      "split": "collection",
      "app_version": null,
      "goals": [
        {"goal_id": "account.signup", "status": "not_explored", "display_status_ko": "미탐색", "evidence_level": "none", "evidence_refs": [], "last_observed_at": null, "blocking_issue": null, "dangerous_action_auto_executed": false, "notes": ""},
        {"goal_id": "account.delete", "status": "not_explored", "display_status_ko": "미탐색", "evidence_level": "none", "evidence_refs": [], "last_observed_at": null, "blocking_issue": null, "dangerous_action_auto_executed": false, "notes": ""},
        {"goal_id": "membership.join", "status": "destination_reached", "display_status_ko": "목적지 도달", "evidence_level": "real_device_verified", "evidence_refs": ["docs/REAL_DEVICE_COLLECTION_2026-08-03.md", "runtime:navs_a22e45b9ba144c58b56e08707c0149f9"], "last_observed_at": "2026-08-03T09:15:48+09:00", "blocking_issue": null, "dangerous_action_auto_executed": false, "notes": "4개 안전 행동으로 J 멤버스 혜택·가입 안내 목적지 도달"},
        {"goal_id": "membership.change", "status": "not_explored", "display_status_ko": "미탐색", "evidence_level": "none", "evidence_refs": [], "last_observed_at": null, "blocking_issue": null, "dangerous_action_auto_executed": false, "notes": ""},
        {"goal_id": "membership.cancel", "status": "not_explored", "display_status_ko": "미탐색", "evidence_level": "none", "evidence_refs": [], "last_observed_at": null, "blocking_issue": null, "dangerous_action_auto_executed": false, "notes": ""}
      ]
    },
    {
      "app_package": "com.twitter.android",
      "app_name": "X",
      "split": "collection",
      "app_version": "12.12.0-release.0+312120000",
      "goals": [
        {"goal_id": "account.signup", "status": "not_explored", "display_status_ko": "미탐색", "evidence_level": "none", "evidence_refs": [], "last_observed_at": null, "blocking_issue": null, "dangerous_action_auto_executed": false, "notes": ""},
        {"goal_id": "account.delete", "status": "not_explored", "display_status_ko": "미탐색", "evidence_level": "none", "evidence_refs": [], "last_observed_at": null, "blocking_issue": null, "dangerous_action_auto_executed": false, "notes": ""},
        {"goal_id": "membership.join", "status": "not_explored", "display_status_ko": "미탐색", "evidence_level": "none", "evidence_refs": [], "last_observed_at": null, "blocking_issue": null, "dangerous_action_auto_executed": false, "notes": ""},